{
  "$schema": "../results.schema.json",
  "schema_version": "1.0.0",
  "experiment_id": "t2_auto_scheduler-001",
  "track": "t2_auto_scheduler",
  "title": "T2 bounded search dry-run and top-candidate replay",
  "status": "completed",
  "owner": "codex",
  "branch": "feat/breakthrough-roadmap-2026q1",
  "commit": "36d22a6",
  "timestamps": {
    "created_at": "2026-02-07T00:00:00Z",
    "started_at": "2026-02-07T17:23:49.194837+00:00",
    "ended_at": "2026-02-07T17:23:49.194837+00:00"
  },
  "environment": {
    "os": "linux",
    "python": "3.12",
    "opencl_platform": "Clover",
    "opencl_device": "AMD Radeon RX 590 GME",
    "driver": "Mesa"
  },
  "baseline_reference": {
    "protocol_doc": "docs/PHASE3_REPRODUCIBLE_PERFORMANCE_BASELINE_FEB2026.md",
    "baseline_commit": "57db7b4",
    "sizes": [
      1400,
      2048,
      3072
    ]
  },
  "parameters": {
    "search_mode": "bounded_dry_run",
    "kernels": [
      "tile20",
      "tile24"
    ],
    "sizes": [
      1400,
      2048
    ],
    "runs_per_config": 3,
    "warmup": 1,
    "top_candidate_replay_sessions": 3,
    "top_candidate_runs_per_session": 3
  },
  "metrics": {
    "peak_gflops_mean": 786.0558748217303,
    "avg_gflops_mean": 786.0558599888726,
    "p95_time_ms": 21.858586666666664,
    "max_error": 0.0016886393229166667,
    "cv_peak": 0.00013737283229154623,
    "delta_vs_baseline_percent": 1.5182584039429607,
    "reproducibility_score": 0.9998626271677085,
    "energy_joules": null
  },
  "validation": {
    "correctness_passed": false,
    "stability_passed": true,
    "promotion_gate_passed": false
  },
  "artifacts": [
    "research/breakthrough_lab/t2_auto_scheduler/dry_run_leaderboard.json",
    "research/breakthrough_lab/t2_auto_scheduler/dry_run_report.md",
    "research/breakthrough_lab/t2_auto_scheduler/dry_run_validation.json"
  ],
  "decision": "iterate",
  "notes": "Dry-run found tile24@2048 slightly above baseline, but below promotion threshold. Correctness gate is not passed under strict <=1e-3 criterion, so continue with search-space refinement."
}